id,category/id,category/name/ca,scope/id,scope/name/ca,participatory_space/id,participatory_space/url,component/id,title,body,state,reference,answer/ca,supports,endorsements/total_count,endorsements/user_endorsements,comments,attachments,followers,published_at,url,meeting_urls,related_proposals,is_amend,original_proposal/title,original_proposal/url
494,,,,,21,https://decidim.santcugat.cat/processes/consellbarrimirasol2019?participatory_process_slug=consellbarrimirasol2019,127,Il·luminar el camí entre l'av. Can Cabassa i el c. Leon de Gredos - 10.000€,Il·luminar el camí entre l'avinguda Can Cabassa i el carrer León de Gredos per millorar la seguretat dels veïns que van a l'estació de FGC.,,SCG-PROP-2019-01-494,,69,0,,0,0,6,2019-01-30 13:25:25 UTC,https://decidim.santcugat.cat/processes/consellbarrimirasol2019/f/127/proposals/494,,,False,,
492,,,,,21,https://decidim.santcugat.cat/processes/consellbarrimirasol2019?participatory_process_slug=consellbarrimirasol2019,127,Instal·lar bancs a les places de Mas Gener - 8000€,Posar bancs a les places de Mas Gener per disposar de més llocs de descans i de relació per a la gent gran.  Es volen fomentar espais de trobada i la vida social del barri.,,SCG-PROP-2019-01-492,,44,0,,0,0,4,2019-01-30 13:15:15 UTC,https://decidim.santcugat.cat/processes/consellbarrimirasol2019/f/127/proposals/492,,,False,,
499,,,,,21,https://decidim.santcugat.cat/processes/consellbarrimirasol2019?participatory_process_slug=consellbarrimirasol2019,127,Adequar les mesures de seguretat a l'escenari del teatre de Mira-sol - 15.000€,"Condicionar l'escenari del teatre de Mira-sol per adequar-lo a les mesures de seguretat.  Fer les actuacions necessàries a la zona de les escales, cantonades i accessos als vestidors.",,SCG-PROP-2019-01-499,,73,0,,0,0,8,2019-01-30 13:43:56 UTC,https://decidim.santcugat.cat/processes/consellbarrimirasol2019/f/127/proposals/499,,,False,,
493,,,,,21,https://decidim.santcugat.cat/processes/consellbarrimirasol2019?participatory_process_slug=consellbarrimirasol2019,127,Posar tendals per fer ombra a les zones de joc infantil - 15.000€,Col·locar tendals naturals o artificials a les zones de joc infantil i a les àrees amb elements esportius per tal de crear espais protegits del sol.,,SCG-PROP-2019-01-493,,133,0,,0,0,5,2019-01-30 13:24:20 UTC,https://decidim.santcugat.cat/processes/consellbarrimirasol2019/f/127/proposals/493,,,False,,
495,,,,,21,https://decidim.santcugat.cat/processes/consellbarrimirasol2019?participatory_process_slug=consellbarrimirasol2019,127,Il·luminar el pati interior del Casal de Mira-sol - 10.000€,Instal·lar nova il·luminació al pati central del Casal de Mira-sol ja que l'actual es considera insuficient.,,SCG-PROP-2019-01-495,,102,0,,0,0,8,2019-01-30 13:26:55 UTC,https://decidim.santcugat.cat/processes/consellbarrimirasol2019/f/127/proposals/495,,,False,,
486,,,,,21,https://decidim.santcugat.cat/processes/consellbarrimirasol2019?participatory_process_slug=consellbarrimirasol2019,127,Adequar un pas per a vianants a l'av. Montserrat Roig / c. Cadí - 30.000€,Habilitar un pas de vianants a l'avinguda Montserrat Roig  amb el carrer Cadí i fer una escala per salvar el talús fins al c. Josep Trueta per tal de facilitar l'accés a l'estació de FGC de forma més segura.,,SCG-PROP-2019-01-486,,91,0,,0,0,4,2019-01-30 12:51:06 UTC,https://decidim.santcugat.cat/processes/consellbarrimirasol2019/f/127/proposals/486,,,False,,
487,,,,,21,https://decidim.santcugat.cat/processes/consellbarrimirasol2019?participatory_process_slug=consellbarrimirasol2019,127,Eixamplar la vorera de l'av. de Can Ganxet davant de l'estació de Mira-sol - 60.000€,"Ampliar el punt més estret de la vorera de l'av. Can Ganxet, al costat del túnel d'accés a l'estació de FGC i el centre comercial de Mira-sol. L'ampliació d'aquest tram facilitaria el pas de vianants i de ciclistes.",,SCG-PROP-2019-01-487,,109,0,,0,0,7,2019-01-30 12:54:08 UTC,https://decidim.santcugat.cat/processes/consellbarrimirasol2019/f/127/proposals/487,,,False,,
488,,,,,21,https://decidim.santcugat.cat/processes/consellbarrimirasol2019?participatory_process_slug=consellbarrimirasol2019,127,Millorar la zona de joc del pati del Casal de Mira-sol - 25.000€,"Millorar el terra de la zona de joc infantil del pati del Casal de Mira-sol, arranjant els desnivells del terreny i posant un sorral.",,SCG-PROP-2019-01-488,,123,0,,0,0,9,2019-01-30 13:02:31 UTC,https://decidim.santcugat.cat/processes/consellbarrimirasol2019/f/127/proposals/488,,,False,,
489,,,,,21,https://decidim.santcugat.cat/processes/consellbarrimirasol2019?participatory_process_slug=consellbarrimirasol2019,127,Crear una zona de socialització de gossos al camí de Sant Cugat al Papiol - 18.000€,Habilitar un espai tancat d'esbarjo i socialització per a gossos a la vora del Camí de Sant Cugat al Papiol (entre el parc infanil i els aparells de gimnàstica). Aquest espai vol contribuir a millorar la convivència i la seguretat dels veïns i els seus animals.,,SCG-PROP-2019-01-489,,171,0,,0,0,9,2019-01-30 13:03:59 UTC,https://decidim.santcugat.cat/processes/consellbarrimirasol2019/f/127/proposals/489,,,False,,
490,,,,,21,https://decidim.santcugat.cat/processes/consellbarrimirasol2019?participatory_process_slug=consellbarrimirasol2019,127,Condicionar el paviment de la pista de Mas Gener - 80.000€,"Arranjar el paviment de la pista de Mas Gener per potenciar aquest espai per a la pràctica esportiva, així com per a activitats lúdiques i culturals del barri.",,SCG-PROP-2019-01-490,,40,0,,0,0,4,2019-01-30 13:05:18 UTC,https://decidim.santcugat.cat/processes/consellbarrimirasol2019/f/127/proposals/490,,,False,,
491,,,,,21,https://decidim.santcugat.cat/processes/consellbarrimirasol2019?participatory_process_slug=consellbarrimirasol2019,127,"Instal·lar bancs i enjardinar la plaça entre els c. Granada, Andalusia i av. Mas Gener - 8.000€","Posar bancs i enjardinar la plaça situada entre els carrers Granada, Andalusia i l'avinguda Mas Gener. Recuperar com a punt de trobada aquest espai conegut com plaça de la cabina o del Simó. ",,SCG-PROP-2019-01-491,,53,0,,0,0,4,2019-01-30 13:08:33 UTC,https://decidim.santcugat.cat/processes/consellbarrimirasol2019/f/127/proposals/491,,,False,,
496,,,,,21,https://decidim.santcugat.cat/processes/consellbarrimirasol2019?participatory_process_slug=consellbarrimirasol2019,127,Millorar acústicament les aules de l'ala nord del Casal de Mira-sol - 20.000€,Millorar l'acústica de les sales de l'ala nord del Casal de Mira-sol mitjançant plafons o algun element similar. L'objectiu és evitar la reverberació i millorar el confort  per a les classes i reunions.,,SCG-PROP-2019-01-496,,28,0,,0,0,6,2019-01-30 13:30:24 UTC,https://decidim.santcugat.cat/processes/consellbarrimirasol2019/f/127/proposals/496,,,False,,
497,,,,,21,https://decidim.santcugat.cat/processes/consellbarrimirasol2019?participatory_process_slug=consellbarrimirasol2019,127,Renovar el mobiliari de l'espai de la gent gran del Casal de Mira-sol - 7000€,Instal·lar nou mobiliari de la biblioteca i el Casal de la gent gran de Mira-sol per emmagatzemar els llibres i  els materials d'activitat.,,SCG-PROP-2019-01-497,,50,0,,0,0,4,2019-01-30 13:33:05 UTC,https://decidim.santcugat.cat/processes/consellbarrimirasol2019/f/127/proposals/497,,,False,,
498,,,,,21,https://decidim.santcugat.cat/processes/consellbarrimirasol2019?participatory_process_slug=consellbarrimirasol2019,127,Instal·lar taquilles al Casal per a les entitats del barri - 12.000€,Instal·lar taquilles (armaris amb clau) al Casal perquè les entitats de Mira-sol hi puguin desar el seu material. Es proposa ubicar els armaris en els passadissos.,,SCG-PROP-2019-01-498,,23,0,,0,0,5,2019-01-30 13:34:20 UTC,https://decidim.santcugat.cat/processes/consellbarrimirasol2019/f/127/proposals/498,,,False,,
500,,,,,21,https://decidim.santcugat.cat/processes/consellbarrimirasol2019?participatory_process_slug=consellbarrimirasol2019,127,Instal·lar semàfor al passeig del Nard amb carrer Pompeu Fabra - 70.000€,Instal·lar un grup semafòric a la intersecció del passeig del Nard amb el carrer Pompeu Fabra. L'objectiu és incrementar la seguretat al pas de vianants i evitar accidents en un punt per on hi passen escolars.,,SCG-PROP-2019-01-500,,48,0,,0,0,5,2019-01-30 13:45:19 UTC,https://decidim.santcugat.cat/processes/consellbarrimirasol2019/f/127/proposals/500,,,False,,
501,,,,,21,https://decidim.santcugat.cat/processes/consellbarrimirasol2019?participatory_process_slug=consellbarrimirasol2019,127,Instal·lar un rocòdrom al parc de Can Mates Oest - 15.000€,Instal·lar un rocòdrom al parc de Can Mates (sector Oest) per facilitar la pràctica de l'esport a l'aire lliure i el joc saludable entre als usuaris del parc. Amb aquesta instal·lació es vol ampliar l'oferta esportiva.,,SCG-PROP-2019-01-501,,92,0,,0,0,8,2019-01-30 13:47:02 UTC,https://decidim.santcugat.cat/processes/consellbarrimirasol2019/f/127/proposals/501,,,False,,
502,,,,,21,https://decidim.santcugat.cat/processes/consellbarrimirasol2019?participatory_process_slug=consellbarrimirasol2019,127,Fer una passarel·la sobre la riera de Can Cabassa (c. Everest) - 35.000€,Construir una passarel·la sobre la riera de Can Cabassa  a l'alçada del c. Everest que comuniqui les dues zones del barri i faciliti l'accés a l'estació de FGC als veïns d'aquesta zona. ,,SCG-PROP-2019-01-502,,116,0,,0,0,7,2019-01-30 13:51:28 UTC,https://decidim.santcugat.cat/processes/consellbarrimirasol2019/f/127/proposals/502,,,False,,
