id,category/id,category/name/ca,scope/id,scope/name/ca,participatory_space/id,participatory_space/url,component/id,title,body,state,reference,answer/ca,supports,endorsements/total_count,endorsements/user_endorsements,comments,attachments,followers,published_at,url,meeting_urls,related_proposals,is_amend,original_proposal/title,original_proposal/url
335,146.0,Inversions (fins 20.000€),,,15,https://decidim.santcugat.cat/processes/consellbarrilafloresta?participatory_process_slug=consellbarrilafloresta,67,Escales al final del c/Pas de l'Estació  (20.000€),"Construir unes escales alternatives a la rampa del c/Pas de l'Estació i que estiguin integrades en el paisatge. Les escales permetrien una via més directa entre el c/Pas de l'Estació i el Carrer Pearson. Estarien ubicades just al costat de la rampa amb forma de zigzag. El principal motiu d'aquestes escales seria poder optimitzar el temps i fer una via més directa entre els dos carrers, especialment pensant en la gent que ha de baixar a l'estació amb presa per agafar algun tren i no donar tanta volta amb la rampa.",,SCG-PROP-2018-02-335,,48,0,,0,1,12,2018-02-15 12:02:01 UTC,https://decidim.santcugat.cat/processes/consellbarrilafloresta/f/67/proposals/335,,,False,,
336,146.0,Inversions (fins 20.000€),,,15,https://decidim.santcugat.cat/processes/consellbarrilafloresta?participatory_process_slug=consellbarrilafloresta,67,Millora de l'espai de la petanca situat al Parc de les Dones (15.000€),"Es tracta d'una banda d'evitar la constant degradació de la pista actual a causa del pas de vehicles de subministrament ja que el pas és massa estret i els perímetres del terreny del joc es trenquen sistemàticament, i de l'altra de millorar l'espai adjacent. És necessari repensar aquest espai, adaptar-lo a les restriccions tècniques mantenint el caràcter de convivència amb el mobiliari lúdic existent.",,SCG-PROP-2018-02-336,,0,0,,0,0,10,2018-02-15 12:09:16 UTC,https://decidim.santcugat.cat/processes/consellbarrilafloresta/f/67/proposals/336,,,False,,
337,146.0,Inversions (fins 20.000€),,,15,https://decidim.santcugat.cat/processes/consellbarrilafloresta?participatory_process_slug=consellbarrilafloresta,67,Bancs  a l’entorn de la Plaça Pere  Planes (6.000€),Bancs per a descansar a la plaça Pere Planes i  alguns dels carrers que surten d'aquesta plaça. Hi ha un mirador perfecte per a col.locar-hi un banc.,,SCG-PROP-2018-02-337,,8,0,,0,0,11,2018-02-15 12:13:13 UTC,https://decidim.santcugat.cat/processes/consellbarrilafloresta/f/67/proposals/337,,,False,,
338,146.0,Inversions (fins 20.000€),,,15,https://decidim.santcugat.cat/processes/consellbarrilafloresta?participatory_process_slug=consellbarrilafloresta,67,"Mobiliari per al nou local de l'Agrupament Escolta ""El Cau"". (8.000€)","L'Agrupament Escolta de La Floresta és una entitat sense ànim de lucre gestionada per joves del barri. Cada setmana s'hi apleguen vuitanta nois i noies de La Floresta, de 6 a 19 anys, per a participar en un projecte educatiu que cerca formar persones sinceres, actives i compromeses tot participant en projectes i activitats. L’Agrupament necessita bancs per a que els infants puguin seure durant les activitats i armaris amb les mides adequades per a guardar el material de l'Agrupament.
",,SCG-PROP-2018-02-338,,0,0,,0,0,10,2018-02-15 12:16:03 UTC,https://decidim.santcugat.cat/processes/consellbarrilafloresta/f/67/proposals/338,,,False,,
339,,,,,15,https://decidim.santcugat.cat/processes/consellbarrilafloresta?participatory_process_slug=consellbarrilafloresta,67,La Font Jabata: Nova font al circuit verd de La Floresta a Valldoreix,"Cada vegada més, les veïnes de la Floresta fem servir el camí de Can Pagan per fer-hi activitat física. Malauradament, no hi ha cap punt d’aigua en tot el camí per poder-se hidratar. Proposem ubicar una font, “La Font Jabata”, per a que les veïnes puguem practicar l’esport i gaudir d’aquesta ruta verda de manera saludable",,SCG-PROP-2018-02-339,,0,0,,0,1,10,2018-02-15 12:21:39 UTC,https://decidim.santcugat.cat/processes/consellbarrilafloresta/f/67/proposals/339,,,False,,
340,146.0,Inversions (fins 20.000€),,,15,https://decidim.santcugat.cat/processes/consellbarrilafloresta?participatory_process_slug=consellbarrilafloresta,67,La Font Jabata: Nova font al circuit verd de La Floresta a Valldoreix (15.000€),"Cada vegada més, les veïnes de la Floresta fem servir el camí de Can Pagan per fer-hi activitat física. Malauradament, no hi ha cap punt d’aigua en tot el camí per poder-se hidratar. Proposem ubicar una font, “La Font Jabata”, per a que les veïnes puguem practicar l’esport i gaudir d’aquesta ruta verda de manera saludable.",,SCG-PROP-2018-02-340,,26,0,,0,1,11,2018-02-16 09:23:27 UTC,https://decidim.santcugat.cat/processes/consellbarrilafloresta/f/67/proposals/340,,,False,,
341,146.0,Inversions (fins 20.000€),,,15,https://decidim.santcugat.cat/processes/consellbarrilafloresta?participatory_process_slug=consellbarrilafloresta,67,Restauració de la Font del Fumet (20.000€),"Recuperació i restauració de la Font del Fumet com a espai emblemàtic i de patrimoni històric  de La Floresta. Recuperació del brollador, enjardinat, reforç dels vorals, instal·lació de senyalització i cartell d’interpretació, ubicació de taules i bancs de fusta per a pícnic i punt de trobada per al veïnat, ciclistes i excursionistes",,SCG-PROP-2018-02-341,,81,0,,0,1,16,2018-02-16 09:34:56 UTC,https://decidim.santcugat.cat/processes/consellbarrilafloresta/f/67/proposals/341,,,False,,
342,146.0,Inversions (fins 20.000€),,,15,https://decidim.santcugat.cat/processes/consellbarrilafloresta?participatory_process_slug=consellbarrilafloresta,67,Guifi·Floresta - Collserola Guifi (20.000€),"Instal·lació d'infraestructura bàsica  per l'elaboració d'una xarxa de comunicacions oberta, lliure i neutral a la Floresta, seguint el model Guifi.net. Es tracta de crear una petita xarxa troncal que connecti diferents punts estratègics de la Floresta (preferentment de titularitat municipal) i que serveixi de punt de partida per que ciutadans i entitats de la Floresta puguin adherir-se de forma autogestionada.
",,SCG-PROP-2018-02-342,,70,1,yuriayau,0,1,11,2018-02-16 09:47:52 UTC,https://decidim.santcugat.cat/processes/consellbarrilafloresta/f/67/proposals/342,,,False,,
343,146.0,Inversions (fins 20.000€),,,15,https://decidim.santcugat.cat/processes/consellbarrilafloresta?participatory_process_slug=consellbarrilafloresta,67,Espai de criança: Estructures de joc d'exterior i material per l'espai familiar al Casino de La Floresta (7.500€),"Instal·lacions i material de joc  i experimentació que  acompanyin i respectin  el desenvolupament psicomotriu dels infants, gaudint  d’un espai familiar gratuït , cuidat  i segur,  a l’interior i exterior del Casino de la Floresta. Un espai diferent als ja existents al barri,  on sorgeixi el joc lliure i els més petits puguin jugar i relacionar-se de manera segura, amb estructures i materials naturals que s’integrin a l’ entorn.",,SCG-PROP-2018-02-343,,98,0,,0,1,17,2018-02-16 09:53:19 UTC,https://decidim.santcugat.cat/processes/consellbarrilafloresta/f/67/proposals/343,,,False,,
344,146.0,Inversions (fins 20.000€),,,15,https://decidim.santcugat.cat/processes/consellbarrilafloresta?participatory_process_slug=consellbarrilafloresta,67,Banc de llibres: Llibreria pública d'intercanvi gratuït de llibres al barri (5.000€),"Fa cosa de cinc anys un grup de veïns i veïnes varen tenir la idea de disposar d'un lloc d'intercanvi gratuït de llibres al barri. Aquest projecte, que es va anomenar ""el banc bo"", es va concretar ubicant, els matins dels diumenges, en un banc de la plaça del poble, unes caixes on poder deixar i poder escollir llibres per emportar-se. Per a donar continuïtat al banc de llibres, es proposa la instal·lació d'una llibreria pública estable a la mateixa plaça, consolidant la iniciativa. Voldríem disposar d'un element de mobiliari urbà fixe, de lliure accés i arrecerat de la pluja, on ubicar els llibres.  ",,SCG-PROP-2018-02-344,,81,0,,0,0,11,2018-02-16 10:07:54 UTC,https://decidim.santcugat.cat/processes/consellbarrilafloresta/f/67/proposals/344,,,False,,
345,146.0,Inversions (fins 20.000€),,,15,https://decidim.santcugat.cat/processes/consellbarrilafloresta?participatory_process_slug=consellbarrilafloresta,67,Amoblem i habitem La Floresta amb estil: Mobiliari urbà de disseny i funcional a l'espai públic (20.000€),"Creació de mobiliari urbà, de disseny i funcional, realitzat amb fusta recuperada de Collserola o local , guardant la forma del tronc d'arbre. L'objectiu és convertir l'espai públic en una llar, càlida i acollidora i fomentar la vida social al carrer amb més qualitat. Estimular el respecte als elements urbans a través de l'instal.lació de peces de qualitat és un repte al vanadalisme. Tot això, per donar a La Floresta una imatge més elegant, amb més identitat. La Floresta és un barri-poble únic, amb un carácter únic, i cal ""vestir-la"" amb estil i personalitat.
",,SCG-PROP-2018-02-345,,27,0,,0,0,11,2018-02-16 10:15:53 UTC,https://decidim.santcugat.cat/processes/consellbarrilafloresta/f/67/proposals/345,,,False,,
346,146.0,Inversions (fins 20.000€),,,15,https://decidim.santcugat.cat/processes/consellbarrilafloresta?participatory_process_slug=consellbarrilafloresta,67,Instal·lació d'un radar informatiu de velocitat a la carretera de Vallvidrera (10.000€),"Instal•lació d’un radar/semàfor no sancionador a la carretera Vallvidrera, que informi de la velocitat als vehicles que travessen els passos de vianants del camí de l’escola. L'objectiu és garantir la seguretat de les persones i en especial dels infants que accedeixin a l’Escola La Floresta i l’espai Polivalent La Floresta, ja sigui individualment o en sortides que els infants realitzin de l’escola.",,SCG-PROP-2018-02-346,,15,0,,0,0,10,2018-02-16 10:21:45 UTC,https://decidim.santcugat.cat/processes/consellbarrilafloresta/f/67/proposals/346,,,False,,
347,146.0,Inversions (fins 20.000€),,,15,https://decidim.santcugat.cat/processes/consellbarrilafloresta?participatory_process_slug=consellbarrilafloresta,67,Material de cuina per a col·lectivitats d'ús comunitari (3.000€),"Tot sovint entitats i col·lectius organitzem actes en què no falta la típica paella popular, la butifarrada o la clàssica xocolotada, per posar algun exemple. Trobar la logística necessària acostuma a ser complicat i, a vegades, car. És per això que proposem comprar olles, difusors, cullerots, gots reutilitzables, plats, etc. d'ús comunitari i a disposar per als col·lectius i entitats del barri.",,SCG-PROP-2018-02-347,,38,0,,0,1,10,2018-02-16 10:43:15 UTC,https://decidim.santcugat.cat/processes/consellbarrilafloresta/f/67/proposals/347,,,False,,
355,146.0,Inversions (fins 20.000€),,,15,https://decidim.santcugat.cat/processes/consellbarrilafloresta?participatory_process_slug=consellbarrilafloresta,67,"Mobiliari per al nou local de l'Agrupament Escolta ""El Cau"" (8.000€)",Al Cau de La Floresta fan falta bancs per a que els infants no hagin de seure a terra durant les activitats. Necessitem també  armaris per a emmagatzemar el material de campaments.  Aquest mobiliari contribuirà a crear unes millors condicions en la nostra tasca educativa i a que els infants del barri de La Floresta puguin gaudir plenament del nou espai del Cau!,,SCG-PROP-2018-02-355,,94,0,,0,1,21,2018-02-16 11:33:02 UTC,https://decidim.santcugat.cat/processes/consellbarrilafloresta/f/67/proposals/355,,,False,,
374,146.0,Inversions (fins 20.000€),,,15,https://decidim.santcugat.cat/processes/consellbarrilafloresta?participatory_process_slug=consellbarrilafloresta,67,Millora de l'espai de la petanca situat al Parc de les Dones (15.000€) ,"Es tracta, d'una banda, d'evitar la constant degradació de la pista actual a causa del pas de vehicles de subministrament, ja que el pas és massa estret i els perímetres del terreny de joc es trenquen sistemàticament, i de l'altra,  millorar l'espai adjacent. És necessari repensar aquest espai, adaptar-lo a les restriccions tècniques mantenint  el caràcter de convivència amb el mobiliari lúdic existent.  Es proposa crear un pas més ampli,  cobrir el canal d'aigua mitjançant una reixa metàl·lica i aprofitar per millorar l'espai amb la creació de bancs de gabions amb seients de fusta.",,SCG-PROP-2018-02-374,,17,0,,0,1,11,2018-02-22 13:50:41 UTC,https://decidim.santcugat.cat/processes/consellbarrilafloresta/f/67/proposals/374,,,False,,
348,147.0,Despesa ordinària (fins 8.000€),,,15,https://decidim.santcugat.cat/processes/consellbarrilafloresta?participatory_process_slug=consellbarrilafloresta,68,"Neteja de deixalles dels boscos de La Floresta 2: retirada de voluminoses, runams i restes de fibrociment (8.000€)","En alguns boscos de la Floresta hi ha abocaments il·legals de deixalles molt voluminoses i runams d'obra, alguns d’elevada toxicitat, com els de fibrociment, que malmeten el medi ambient i són perillosos per als animals i les persones. Aquest projecte pretén retirar-los amb l’ús d’especialistes i maquinària.",,SCG-PROP-2018-02-348,,136,0,,0,1,11,2018-02-16 10:51:16 UTC,https://decidim.santcugat.cat/processes/consellbarrilafloresta/f/68/proposals/348,,,False,,
349,147.0,Despesa ordinària (fins 8.000€),,,15,https://decidim.santcugat.cat/processes/consellbarrilafloresta?participatory_process_slug=consellbarrilafloresta,68,Trivial del Centenari de La Floresta (5.000€),"Es proposa celebrar els 100 anys de La Floresta amb un joc de Trivial que reuneixi i mantingui viva la memòria històrica i social del poble.  La recopilació de dades i de preguntes/respostes es farà a través d’un procés participatiu amb la intenció d’arribar i involucrar al màxim de florestanes i florestans, utilitzant les xarxes socials, cartells distribuïts pel barri i a través del consell de barri, per tal de reunir les preguntes, difondre el joc i motivar la creació col•lectiva.
",,SCG-PROP-2018-02-349,,10,0,,0,1,10,2018-02-16 10:54:46 UTC,https://decidim.santcugat.cat/processes/consellbarrilafloresta/f/68/proposals/349,,,False,,
350,147.0,Despesa ordinària (fins 8.000€),,,15,https://decidim.santcugat.cat/processes/consellbarrilafloresta?participatory_process_slug=consellbarrilafloresta,68,Club de lectura - Biblioteca de La Floresta (2.500€),"Finançament de la creació d'un club de lectura, ubicat al Centre Social i Sanitari i  vinculat a les biblioteques de Sant Cugat, a l'espera de consolidar una secció pròpia a la Floresta.",,SCG-PROP-2018-02-350,,69,0,,0,0,11,2018-02-16 11:00:31 UTC,https://decidim.santcugat.cat/processes/consellbarrilafloresta/f/68/proposals/350,,,False,,
351,147.0,Despesa ordinària (fins 8.000€),,,15,https://decidim.santcugat.cat/processes/consellbarrilafloresta?participatory_process_slug=consellbarrilafloresta,68,"Suport a la producció del documental ""100 anys de La Floresta"" (8.000€)","En motiu del centenari de la Floresta, la Comissió de Patrimoni i Memòria volem fer un documental que reculli la història del barri al llarg d'aquests 100 anys. Dividirem el segle en períodes de 10-20 anys, segons esdeveniments importants. Entrevistarem veïns/es i historiadors, buscarem imatges d'arxiu i enregistrarem imatges actuals. El documental quedarà per al barri. ",,SCG-PROP-2018-02-351,,87,0,,0,0,12,2018-02-16 11:03:12 UTC,https://decidim.santcugat.cat/processes/consellbarrilafloresta/f/68/proposals/351,,,False,,
352,147.0,Despesa ordinària (fins 8.000€),,,15,https://decidim.santcugat.cat/processes/consellbarrilafloresta?participatory_process_slug=consellbarrilafloresta,68,Recursos i elements per dinamitzar l'Assemblea d'Infants de La Floresta (2.000€),"L’assemblea d’infants de la Floresta ja és una realitat. Es reuneixen un cop al mes i comencen a tenir identitat pròpia. Per tal que puguin tirar endavant les seves iniciatives i les sessions es puguin dinamitzar el millor possible, és necessari dotar de recursos el projecte i així desenvolupar propostes que ja tenen sobre la taula, com ara: fer samarretes, pancartes, actes, material de difusió, etc. ",,SCG-PROP-2018-02-352,,53,0,,0,0,10,2018-02-16 11:14:06 UTC,https://decidim.santcugat.cat/processes/consellbarrilafloresta/f/68/proposals/352,,,False,,
353,147.0,Despesa ordinària (fins 8.000€),,,15,https://decidim.santcugat.cat/processes/consellbarrilafloresta?participatory_process_slug=consellbarrilafloresta,68,Metodologia de control de mosquits aplicada al barri de La Floresta - Anàlisi en grup dels resultats previs i elaboració de proposta sostenible de control (200€),"Per millorar la qualitat de vida del veïnat caldria dissenyar un programa de control raonable i factible basat en l’eliminació de focus de cria, afavorint la biodiversitat de l’àrea. Per aconseguir-ho és imprescindible la participació dels diversos col·lectius del barri i l’Ajuntament. El pressupost seria utilitzat per impulsar les accions control.",,SCG-PROP-2018-02-353,,86,0,,0,1,10,2018-02-16 11:19:52 UTC,https://decidim.santcugat.cat/processes/consellbarrilafloresta/f/68/proposals/353,,,False,,
354,147.0,Despesa ordinària (fins 8.000€),,,15,https://decidim.santcugat.cat/processes/consellbarrilafloresta?participatory_process_slug=consellbarrilafloresta,68,La Floresta Territori: Elaboració d'una versió il·lustrada del mapa de La Floresta (8.000€),"La Floresta va néixer, fa cent anys, com una ciutat jardí, és a dir, com un indret on viure en contacte amb la natura. Amb els anys, el creixement urbà de la plana ha acorralat La Floresta en una frontera que divideix el món urbà del món natural. Però aquest límit no és real: la Floresta és justament un territori de convivència entre la ciutat i el bosc, entre les persones i el seu entorn. Això mereix posar-ho en valor. És proposa la creació d'una gran il·lustració que mostri les seves carenes assoleiades, les seves rieres, les seves dreceres, els camins dels animals i les persones, les migdiades sota un pi...",,SCG-PROP-2018-02-354,,0,0,,0,0,10,2018-02-16 11:28:44 UTC,https://decidim.santcugat.cat/processes/consellbarrilafloresta/f/68/proposals/354,,,False,,
375,147.0,Despesa ordinària (fins 8.000€),,,15,https://decidim.santcugat.cat/processes/consellbarrilafloresta?participatory_process_slug=consellbarrilafloresta,68,La Floresta Territori: Elaboració d'una versió il·lustrada del mapa de La Floresta (8.000€),"Proposem realitzar el primer mapa il·lustrat a escala de La Floresta, que ens permeti descobrir la història del nostre entorn com a el lloc d'encontre entre la plana i la muntanya, l'activitat humana i la natura.
La imatge es concep  per  il·lustrar el Mapa Interactiu de la Floresta que s’està preparant amb motiu del seu centenari. Representant tot el territori habitat i els seus voltans naturals, l’ il·lustració complementarà les informacions històriques i naturals del mapa interactiu, dibuixant un pont entre el passat i la vida actual a la Floresta. Una il·lustració, per tant, en la que sentir-nos representats, i que al ser digitalitzada, podrem utilitzar en diferents suports al llarg del temps.
",,SCG-PROP-2018-02-375,,50,0,,0,1,11,2018-02-22 14:03:02 UTC,https://decidim.santcugat.cat/processes/consellbarrilafloresta/f/68/proposals/375,,,False,,
